<?xml version="1.0" encoding="UTF-8"?>
<client xmlns="http://www.solms.co.za/clients"
    xmlns:xsi="http://www.w3.org/2001/XMLSchema-instance"
    xsi:schemaLocation="http://www.solms.co.za/clients abstractType.xsd">
  <name>Jack</name>
  <account xsi:type="ChequeAccount">
    <balance>6542</balance>
    <accountNo>2765</accountNo>
    <chequeFee>23.34</chequeFee>
    <overdraftLimit>5000</overdraftLimit>
  </account>
  <account xsi:type="CreditCardAccount" type="MASTER">
    <balance>222</balance>
    <accountNo>235324</accountNo>
    <expiryDate>2006-10-10</expiryDate>
    <issuer>FNB</issuer>
  </account>
  
</client>
